{
    "schemaVersion":  1,
    "id":  "quality-static-analysis-001",
    "version":  1,
    "title":  "Analyse statique et avertissements traités",
    "week":  17,
    "skills":  [
                   {
                       "id":  "quality.analysis",
                       "weight":  1
                   }
               ],
    "prerequisites":  [
                          "quality-regression-refactoring-001"
                      ],
    "estimatedMinutes":  75,
    "objectives":  [
                       "Appliquer Analyse statique et avertissements traités et justifier une preuve observable sur un cas nouveau"
                   ],
    "sections":  [
                     "intuition",
                     "explanation",
                     "example",
                     "counterExample",
                     "check",
                     "guided",
                     "independent",
                     "debugging",
                     "interview",
                     "summary",
                     "reviewCards",
                     "masteryTest"
                 ],
    "markdownPath":  "lesson.md",
    "license":  "CC-BY-4.0"
}
