{
    "schemaVersion":  1,
    "id":  "front-blazor-essentials-001",
    "version":  1,
    "title":  "Blazor : Server ou WebAssembly, paramètres, interop et état d'authentification",
    "week":  27,
    "skills":  [
                   {
                       "id":  "csharp.blazor",
                       "weight":  1
                   }
               ],
    "prerequisites":  [
                          "front-controlled-forms-001",
                          "front-client-server-contract-001"
                      ],
    "estimatedMinutes":  60,
    "objectives":  [
                       "Choisir entre Blazor Server et WebAssembly selon leurs conséquences réelles, passer des paramètres et paramètres cascadés, appeler du JavaScript par interop, situer le cycle de rendu et lire l'état d'authentification"
                   ],
    "sections":  [
                     "intuition",
                     "explanation",
                     "example",
                     "counterExample",
                     "check",
                     "guided",
                     "independent",
                     "debugging",
                     "interview",
                     "summary",
                     "reviewCards",
                     "masteryTest"
                 ],
    "markdownPath":  "lesson.md",
    "license":  "CC-BY-4.0"
}
