{
    "schemaVersion":  1,
    "id":  "security-owasp-api-001",
    "version":  1,
    "title":  "Socle OWASP pour une API locale",
    "week":  14,
    "skills":  [
                   {
                       "id":  "security.owasp",
                       "weight":  1
                   }
               ],
    "prerequisites":  [
                          "security-authorization-roles-policies-001"
                      ],
    "estimatedMinutes":  75,
    "objectives":  [
                       "Appliquer Socle OWASP pour une API locale et justifier une preuve observable sur un cas nouveau"
                   ],
    "sections":  [
                     "intuition",
                     "explanation",
                     "example",
                     "counterExample",
                     "check",
                     "guided",
                     "independent",
                     "debugging",
                     "interview",
                     "summary",
                     "reviewCards",
                     "masteryTest"
                 ],
    "markdownPath":  "lesson.md",
    "license":  "CC-BY-4.0"
}
