{
    "schemaVersion":  1,
    "id":  "structures-trees-001",
    "version":  1,
    "title":  "Arbres minimaux et parcours",
    "week":  6,
    "skills":  [
                   {
                       "id":  "structures.trees",
                       "weight":  1
                   }
               ],
    "prerequisites":  [
                          "structures-dictionaries-recursion-001"
                      ],
    "estimatedMinutes":  70,
    "objectives":  [
                       "Expliquer puis appliquer Arbres minimaux et parcours sur un cas métier borné"
                   ],
    "sections":  [
                     "intuition",
                     "explanation",
                     "example",
                     "counterExample",
                     "check",
                     "guided",
                     "independent",
                     "debugging",
                     "interview",
                     "summary",
                     "reviewCards",
                     "masteryTest"
                 ],
    "markdownPath":  "lesson.md",
    "license":  "CC-BY-4.0"
}
