{
    "schemaVersion":  1,
    "id":  "observability-correlation-001",
    "version":  1,
    "title":  "Logs structurés, métriques et corrélation",
    "week":  22,
    "skills":  [
                   {
                       "id":  "observability.signals",
                       "weight":  1
                   }
               ],
    "prerequisites":  [
                          "azure-managed-identity-key-vault-001"
                      ],
    "estimatedMinutes":  80,
    "objectives":  [
                       "Appliquer Logs structurés, métriques et corrélation à un cas nouveau et défendre la preuve observable associée"
                   ],
    "sections":  [
                     "intuition",
                     "explanation",
                     "example",
                     "counterExample",
                     "check",
                     "guided",
                     "independent",
                     "debugging",
                     "interview",
                     "summary",
                     "reviewCards",
                     "masteryTest"
                 ],
    "markdownPath":  "lesson.md",
    "license":  "CC-BY-4.0"
}
