{
    "schemaVersion":  1,
    "id":  "final-defense-english-001",
    "version":  1,
    "title":  "Défendre une architecture en anglais professionnel",
    "week":  24,
    "skills":  [
                   {
                       "id":  "english.defense",
                       "weight":  1
                   }
               ],
    "prerequisites":  [
                          "final-project-evidence-001"
                      ],
    "estimatedMinutes":  80,
    "objectives":  [
                       "Appliquer Défendre une architecture en anglais professionnel à un cas nouveau et défendre la preuve observable associée"
                   ],
    "sections":  [
                     "intuition",
                     "explanation",
                     "example",
                     "counterExample",
                     "check",
                     "guided",
                     "independent",
                     "debugging",
                     "interview",
                     "summary",
                     "reviewCards",
                     "masteryTest"
                 ],
    "markdownPath":  "lesson.md",
    "license":  "CC-BY-4.0"
}
